{
  "schemaVersion": 1,
  "revision": 1,
  "show": "false",
  "type": "multi_action",
  "title": "&6Trader",
  "externalTitle": "Trader",
  "canCloseWithEscape": true,
  "pause": false,
  "afterAction": "close",
  "body": [
    {
      "type": "text",
      "text": "Pick a trade, {{ viewer.name }}.",
      "width": 220
    },
    {
      "type": "item",
      "item": { "type": "item", "item": "minecraft:emerald" },
      "description": "&aEmeralds accepted",
      "showTooltip": true,
      "showDecorations": true,
      "width": 220,
      "height": 20
    }
  ],
  "inputs": [
    { "type": "number", "key": "qty", "label": "Quantity", "start": 1, "end": 64, "step": 1, "initial": 1, "width": 200 },
    { "type": "option", "key": "color", "label": "Color", "options": [
      { "id": "red", "label": "Red" },
      { "id": "blue", "label": "Blue", "initial": true }
    ] },
    { "type": "bool", "key": "gift", "label": "Gift wrap", "initial": false },
    { "type": "text", "key": "note", "label": "Note", "initial": "", "maxLength": 32, "multiline": { "maxLines": 2, "height": 40 } }
  ],
  "buttons": [
    {
      "label": "&aBuy",
      "tooltip": "Buys {{ input.qty }} {{ input.color }}",
      "width": 150,
      "actions": [
        { "type": "economy", "op": "withdraw", "amount": "{{ input.qty }} * 10", "denyMessage": "&cNot enough coins." },
        { "type": "message", "message": "&aBought {{ input.qty }} {{ input.color }}." }
      ]
    },
    { "label": "&7Later", "actions": [] }
  ],
  "exit": { "label": "Close" },
  "columns": 2,
  "fallback": { "inventory": "example" },
  "variants": []
}
